{
 "id": "w:ke",
 "th": "เก",
 "status": "mapped",
 "rtgs": "ke",
 "paiboon": "gee",
 "ipa": "/keː˧/",
 "stratum": "unknown",
 "freq": "core",
 "senses": [
  {
   "n": 1,
   "gloss": {
    "en": [
     "out of line",
     "crooked",
     "askew"
    ],
    "th": "ไม่ตรงตามแนว, ไม่เป็นระเบียบ ใช้แก่ของที่เป็นซี่เป็นลำ",
    "conf": "standard",
    "src": [
     "CUR",
     "RID"
    ]
   },
   "pos": "adjective, verb",
   "pos_th": "คำคุณศัพท์, คำกริยา",
   "order_conf": "unverified",
   "conf": "probable",
   "src": [
    "RID",
    "WIKT"
   ],
   "needs_check": [
    "Sense order is the RID's, not an argument about semantic development. Rank it, then set order_conf.",
    "Declared root: เก 'out of line'.",
    "Declared root: เก 'out of line'.",
    "Declared root: เก 'out of line'."
   ]
  },
  {
   "n": 2,
   "gloss": {
    "en": [
     "[needs an English gloss — RID sense 2]"
    ],
    "th": "ไม่ยอมปฏิบัติตามระเบียบ",
    "conf": "unverified",
    "src": [
     "RID"
    ]
   },
   "pos": "adjective, verb",
   "pos_th": "คำคุณศัพท์, คำกริยา",
   "order_conf": "unverified",
   "conf": "probable",
   "src": [
    "RID",
    "WIKT"
   ],
   "extends": 1,
   "via": "metaphor",
   "via_note": "Out of line with the rules: not falling in.",
   "via_conf": "probable"
  },
  {
   "n": 3,
   "gloss": {
    "en": [
     "[needs an English gloss — RID sense 3]"
    ],
    "th": "เกะกะ, เกเร",
    "conf": "unverified",
    "src": [
     "RID"
    ]
   },
   "pos": "adjective, verb",
   "pos_th": "คำคุณศัพท์, คำกริยา",
   "order_conf": "unverified",
   "conf": "probable",
   "src": [
    "RID",
    "WIKT"
   ],
   "compounds": [
    {
     "th": "เกเร",
     "rtgs": "ke-re",
     "ipa": "/keː˧.reː˧/",
     "gloss": {
      "en": [
       "act up"
      ],
      "th": "เกกมะเหรก, มีนิสัยเป็นพาล ชอบแกล้งชอบรังแกและเอาเปรียบเขา",
      "conf": "verified",
      "src": [
       "RID",
       "WIKT"
      ]
     },
     "parts": [
      "เก",
      "เร"
     ],
     "note": "head-initial; both parts are dictionary headwords · filed under sense 3: the sense gloss names this compound",
     "conf": "verified",
     "src": [
      "RID",
      "WIKT"
     ],
     "pattern": "ADJ+N",
     "head": 0,
     "lit_th": "เกะกะ + โน้ตตัวที่สองในสเกลซีเมเจอร์ มีสัญ",
     "frame": "quality"
    }
   ],
   "extends": 2,
   "via": "specialisation",
   "via_note": "And so unruly, delinquent.",
   "via_conf": "probable"
  },
  {
   "n": 4,
   "gloss": {
    "en": [
     "[needs an English gloss — RID sense 4]"
    ],
    "th": "ท้าพนันด้วยการเสนอเงินเดิมพันสูงขึ้นเรื่อย ๆ",
    "conf": "unverified",
    "src": [
     "RID"
    ]
   },
   "pos": "adjective, verb",
   "pos_th": "คำคุณศัพท์, คำกริยา",
   "order_conf": "unverified",
   "conf": "probable",
   "src": [
    "RID",
    "WIKT"
   ],
   "needs_check": [
    "Declared root: เก, to raise a wager — separate.",
    "Declared root: เก, to raise a wager — separate.",
    "Declared root: เก, to raise a wager — separate."
   ],
   "compounds": [
    {
     "th": "เกทับ",
     "rtgs": "ke-thap",
     "ipa": "/keː˧.tʰap̚˦˥/",
     "gloss": {
      "en": [
       "[needs a gloss]"
      ],
      "th": "วางเงินพนันเป็นจำนวนมากกว่าคู่แข่งเพื่อแสดงว่าตนมีไพ่เหนือกว่า",
      "conf": "unverified",
      "src": [
       "RID"
      ]
     },
     "parts": [
      "เก",
      "ทับ"
     ],
     "note": "head-initial; both parts are dictionary headwords · filed under sense 4 by hand",
     "conf": "standard",
     "src": [
      "CUR",
      "RID",
      "WIKT"
     ],
     "pattern": "ADJ+N",
     "head": 0,
     "cross_listed": [
      "ทับ"
     ],
     "lit": "out of line + hut",
     "lit_th": "ท้าพนันด้วยการเสนอเงินเดิมพันสูงขึ + กระท่อมหรือสิ่งปลูกสร้างที่ทำอยู่ช",
     "frame": "quality"
    }
   ]
  }
 ],
 "conf": "probable",
 "src": [
  "RID",
  "WIKT",
  "thai-full.json"
 ],
 "needs_check": [
  "Auto-ingested: senses are listed in the RID's order and no EXTENDS chain has been asserted. Order the senses and file each compound under the one that motivates it to reach status 'mapped'.",
  "Attested in this corpus: 64 manuscript titles, 1230 item titles. Turn the useful ones into ATTESTED_IN edges.",
  "Compound filing is tiered: entries marked 'verified' were filed by a source, 'probable' by gloss similarity. Neither orders the senses, so this entry is 'proposed', not 'mapped'.",
  "Compound filing is tiered: entries marked 'verified' were filed by a source, 'probable' by gloss similarity. Neither orders the senses, so this entry is 'proposed', not 'mapped'.",
  "Compound filing is tiered: entries marked 'verified' were filed by a source, 'probable' by gloss similarity. Neither orders the senses, so this entry is 'proposed', not 'mapped'.",
  "Compound filing is tiered: entries marked 'verified' were filed by a source, 'probable' by gloss similarity. Neither orders the senses, so this entry is 'proposed', not 'mapped'."
 ],
 "editorial": "Generated by lexicon_ingest.py. Generativity 23; domain seeded by keyword hits —.",
 "compounds_unassigned": [
  {
   "th": "เกรน",
   "rtgs": "kren",
   "ipa": "/kreːn˧/",
   "gloss": {
    "en": [
     "[needs a gloss]"
    ],
    "th": "มาตราชั่งอย่างหนึ่งของอังกฤษ 1 เกรน เท่ากับ 64.799 มิลลิกรัม",
    "conf": "unverified",
    "src": [
     "RID"
    ]
   },
   "parts": [
    "เก",
    "รน"
   ],
   "note": "head-initial; both parts are dictionary headwords · NOT a compound of this head: the etymology says the whole word is borrowed",
   "conf": "verified",
   "src": [
    "RID",
    "WIKT"
   ],
   "pattern": "ADJ+V",
   "head": 0,
   "lit_th": "ไม่ตรงตามแนว + นิ่งอยู่ไม่ได้",
   "frame": "quality",
   "use": "false-split"
  },
  {
   "th": "เกล้า",
   "rtgs": "klao",
   "ipa": "/klaːw˥˩/",
   "gloss": {
    "en": [
     "[needs a gloss]"
    ],
    "th": "หัว (ใช้เฉพาะในโวหารแสดงความเคารพอย่างสูง)",
    "conf": "unverified",
    "src": [
     "RID"
    ]
   },
   "parts": [
    "เก",
    "ล้า"
   ],
   "note": "head-initial; both parts are dictionary headwords · NOT a compound of this head: the head, in honorific register. สืบทอดจากไทดั้งเดิม *krawꟲ ('หัว') — one inherited Proto-Tai morpheme.",
   "conf": "verified",
   "src": [
    "RID",
    "WIKT"
   ],
   "pattern": "ADJ+ADJ",
   "head": 0,
   "lit_th": "ไม่ตรงตามแนว + หย่อนแรงหรือกำลัง",
   "frame": "quality",
   "use": "false-split"
  },
  {
   "th": "จังเก",
   "rtgs": "chang-ke",
   "ipa": "/t͡ɕaŋ˧.keː˧/",
   "gloss": {
    "en": [
     "[needs a gloss]"
    ],
    "th": "สะเอว",
    "conf": "unverified",
    "src": [
     "RID"
    ]
   },
   "parts": [
    "จัง",
    "เก"
   ],
   "note": "head-final; both parts are dictionary headwords · NOT a compound of this head: the etymology says the whole word is borrowed",
   "conf": "verified",
   "src": [
    "RID",
    "WIKT"
   ],
   "head": 1,
   "lit_th": "ยิ่งนัก + ไม่ตรงตามแนว",
   "use": "false-split"
  },
  {
   "th": "เกสี",
   "rtgs": "ke-si",
   "ipa": "/keː˧.siː˩˩˦/",
   "gloss": {
    "en": [
     "[needs a gloss]"
    ],
    "th": "ผม",
    "conf": "unverified",
    "src": [
     "RID"
    ]
   },
   "parts": [
    "เก",
    "สี"
   ],
   "note": "head-initial; both parts are dictionary headwords · NOT a compound of this head: hair. Sanskrit केश keśa. Already tagged false-split on the head สี for the same reason.",
   "conf": "probable",
   "src": [
    "RID",
    "WIKT"
   ],
   "pattern": "ADJ+N",
   "head": 0,
   "cross_listed": [
    "สี"
   ],
   "lit": "out of line + color",
   "lit_th": "ไม่ตรงตามแนว + ชื่อเครื่องสำหรับหมุนบดข้าวเปลือกเ",
   "frame": "quality",
   "use": "false-split"
  },
  {
   "th": "ลิเก",
   "rtgs": "li-ke",
   "ipa": "/li˦˥.keː˧/",
   "gloss": {
    "en": [
     "[needs a gloss]"
    ],
    "th": "การแสดงชนิดหนึ่งมาจากชาวมลายู",
    "conf": "unverified",
    "src": [
     "RID"
    ]
   },
   "parts": [
    "ลิ",
    "เก"
   ],
   "note": "head-final; both parts are dictionary headwords · NOT a compound of this head: the folk opera. ยืมโดยกึ่งเรียนรู้จากเปอร์เซียคลาสสิก ذکر (ษิกร), จากอาหรับ ذِكْر — Persian zikr from Arabic, a whole borrowing.",
   "conf": "verified",
   "src": [
    "RID",
    "WIKT"
   ],
   "pattern": "V+ADJ",
   "head": 1,
   "lit_th": "แตกบิ่นไปเล็กน้อย + ไม่ตรงตามแนว",
   "frame": "quality",
   "use": "false-split"
  },
  {
   "th": "เกลื้อ",
   "rtgs": "kluea",
   "ipa": "/klɯa̯˥˩/",
   "gloss": {
    "en": [
     "[needs a gloss]"
    ],
    "th": "เกลือก, เกลี้ย, กลั้ว, ระคน, เจือ",
    "conf": "unverified",
    "src": [
     "RID"
    ]
   },
   "parts": [
    "เก",
    "ลื้อ"
   ],
   "note": "head-initial; both parts are dictionary headwords · NOT a compound of this head: to mix or mingle. One syllable with a กล- cluster. The remaining เก- is the onset of a single syllable, not a word.",
   "conf": "probable",
   "src": [
    "RID",
    "WIKT"
   ],
   "pattern": "ADJ+PROP",
   "head": 0,
   "frame": "quality",
   "use": "false-split"
  },
  {
   "th": "เกวัฏ",
   "rtgs": "ke-wat",
   "ipa": "/keː˧.wat̚˦˥/",
   "gloss": {
    "en": [
     "[needs a gloss]"
    ],
    "th": "ชาวประมง, พรานเบ็ด, พรานแห, พรานปลา",
    "conf": "unverified",
    "src": [
     "RID"
    ]
   },
   "parts": [
    "เก",
    "วัฏ"
   ],
   "note": "head-initial; both parts are dictionary headwords · NOT a compound of this head: the etymology says the whole word is borrowed",
   "conf": "verified",
   "src": [
    "RID",
    "WIKT"
   ],
   "pattern": "ADJ+N",
   "head": 0,
   "lit_th": "ไม่ตรงตามแนว + วงกลม",
   "frame": "quality",
   "use": "false-split"
  },
  {
   "th": "เกศวะ",
   "rtgs": "ke-sa-wa",
   "ipa": "/keː˧.sa˨˩.waʔ˦˥/",
   "gloss": {
    "en": [
     "[needs a gloss]"
    ],
    "th": "ผู้มีผมงาม, ใช้เป็นนามของพระนารายณ์หรือพระกฤษณะ ซึ่งเป็นอวตารปางหนึ่งของพระนารายณ์",
    "conf": "unverified",
    "src": [
     "RID"
    ]
   },
   "parts": [
    "เก",
    "ศวะ"
   ],